============================================================
📊  PHASE 1 SUMMARY — PHI4_QLORA
============================================================
  Scored      : 150 / 150 samples
  Overall avg : 2.48 / 5.0

  Score distribution:
    5/5  █████████████████████████████████ (33)
    4/5  ███████████ (11)
    3/5  ██ (2)
    2/5  █████████████████████████████████████████████████████ (53)
    1/5  ███████████████████████████████████████████████████ (51)

  By task type:
    Act Identification   avg=4.46  (n=39)
    Direct Q&A           avg=1.23  (n=31)
    Explanation          avg=2.31  (n=59)
    Summarization        avg=1.14  (n=21)
============================================================



============================================================
📊  PHASE 1 SUMMARY — PHI4_LORA
============================================================
  Scored      : 150 / 150 samples
  Overall avg : 2.32 / 5.0

  Score distribution:
    5/5  █████████████████████████ (25)
    4/5  ██████████████ (14)
    3/5  ███ (3)
    2/5  ██████████████████████████████████████████████████ (50)
    1/5  ██████████████████████████████████████████████████████████ (58)

  By task type:
    Act Identification   avg=3.92  (n=39)
    Direct Q&A           avg=1.13  (n=31)
    Explanation          avg=2.34  (n=59)
    Summarization        avg=1.05  (n=21)
============================================================



============================================================
📊  PHASE 1 SUMMARY — QWEN3_QLORA
============================================================
  Scored      : 150 / 150 samples
  Overall avg : 2.65 / 5.0

  Score distribution:
    5/5  █████████████████████████████████████ (37)
    4/5  ██████████████ (14)
    3/5   (0)
    2/5  ██████████████████████████████████████████████████████████ (58)
    1/5  █████████████████████████████████████████ (41)

  By task type:
    Act Identification   avg=4.77  (n=39)
    Direct Q&A           avg=1.35  (n=31)
    Explanation          avg=2.42  (n=59)
    Summarization        avg=1.29  (n=21)
============================================================



============================================================
📊  PHASE 1 SUMMARY — QWEN3_LORA
============================================================
  Scored      : 150 / 150 samples
  Overall avg : 2.36 / 5.0

  Score distribution:
    5/5  ██████████████████████████ (26)
    4/5  ███████████████ (15)
    3/5  █ (1)
    2/5  █████████████████████████████████████████████████████ (53)
    1/5  ███████████████████████████████████████████████████████ (55)

  By task type:
    Act Identification   avg=3.95  (n=39)
    Direct Q&A           avg=1.13  (n=31)
    Explanation          avg=2.41  (n=59)
    Summarization        avg=1.10  (n=21)
============================================================



============================================================
📊  PHASE 1 SUMMARY — GEMMA3_QLORA
============================================================
  Scored      : 150 / 150 samples
  Overall avg : 2.57 / 5.0

  Score distribution:
    5/5  ███████████████████████████████████ (35)
    4/5  ███████████ (11)
    3/5  █ (1)
    2/5  █████████████████████████████████████████████████████████████ (61)
    1/5  ██████████████████████████████████████████ (42)

  By task type:
    Act Identification   avg=4.59  (n=39)
    Direct Q&A           avg=1.16  (n=31)
    Explanation          avg=2.34  (n=59)
    Summarization        avg=1.57  (n=21)
============================================================


============================================================
📊  PHASE 1 SUMMARY — GEMMA3_LORA
============================================================
  Scored      : 150 / 150 samples
  Overall avg : 2.35 / 5.0

  Score distribution:
    5/5  ██████████████████████████ (26)
    4/5  ███████████ (11)
    3/5  ███ (3)
    2/5  ███████████████████████████████████████████████████████████ (59)
    1/5  ███████████████████████████████████████████████████ (51)

  By task type:
    Act Identification   avg=3.97  (n=39)
    Direct Q&A           avg=1.23  (n=31)
    Explanation          avg=2.27  (n=59)
    Summarization        avg=1.19  (n=21)
============================================================